ID,Name,Blurb,Goal,Slug,Country,Pledged,Backers_count,Currency,Deadline,Created_at,Launched_at,Staff_pick,Category_id,Category_name,Location_id,Location_name,Location_country,Location_state,fx_rate,Percent_funded
2144632984,d20Pro Unlimited Virtual Tabletop,"Reforging the d20Pro virtual tabletop; adding the Unlimited Rules Engine, Native multitouch support, Shadowcasting fog of war and more.",10000,d20pro-unlimited-virtual-tabletop,US,82785,1792,USD,1410613277,1399502257,1407502877,TRUE,34,Tabletop Games,2405641,Fort Collins,US,CO,1,827.85
21276479,Jon Shafer's At the Gates,"Lead a barbarian kingdom to glory during the final days of the Roman Empire. An empire builder by Jon Shafer, designer of Civ 5.",40000,jon-shafers-at-the-gates,US,106283.85,3009,USD,1362754647,1355540087,1360162647,TRUE,35,Video Games,2402469,Farmington,US,MI,1,265.709625
1601562917,Re:Legend - Co-op Monster-Raising RPG,An all-encompassing RPG-simulator hybrid with strong monster-raising and multiplayer features.,70000,re-legend-co-op-monster-raising-rpg,SG,630700,7385,SGD,1503664827,1489638286,1501072827,TRUE,35,Video Games,1154781,Kuala Lumpur,MY,Kuala Lumpur,0.73643342,901
1464413429,Bloom: Memories -- A new kind of action adventure RPG!,"Experience a world and story unlike any other! This is a passion project made with a deep love for games. For gamers, by gamers.",40000,bloom-memories-a-new-kind-of-action-adventure-rpg,US,61517.7,2525,USD,1386712861,1381358700,1383688861,TRUE,35,Video Games,2442047,Los Angeles,US,CA,1,153.79425
1314258248,System Shock,"System Shock is a complete remake of the genre defining classic from 1994 built by a team of industry veterans. 

Remember Citadel.",900000,system-shock,US,1350700.17,21625,USD,1469732570,1453945033,1467140570,TRUE,35,Video Games,2511258,Vancouver,US,WA,1,150.0777967
606910105,Dark Souls™ - The Board Game,"Dark Souls™ - The Board Game is a strategically challenging, deeply immersive combat exploration game for 1-4 players.",50000,dark-soulstm-the-board-game,GB,3771474.81,31178,GBP,1463425172,1435319639,1461092372,TRUE,34,Tabletop Games,36177,Stockport,GB,England,1.33559137,7542.94962
1476423132,Ascension Online,"Bring the Ascension Deckbuilding Game to Android and PC with new features like online tournaments, campaign mode, and more!",125000,ascension-online,US,184563.24,2754,USD,1362103200,1359495848,1361152810,TRUE,35,Video Games,2375062,Carlsbad,US,CA,1,147.650592
753659998,Boyfriend Dungeon: Date Your Weapons!,"Romance your swords! Capture the hearts of weapons (m, f, nb) to level them up in this shack-and-slash dungeon-crawling video game.",65579,boyfriend-dungeon-date-your-weapons,CA,272280.42,6991,CAD,1537027397,1525198950,1534348997,TRUE,35,Video Games,3534,Montreal,CA,QC,0.7647932,415.1945287
827888793,Marvel United,Take the role of Marvel's mightiest Heroes and thwart the Villain's plans in this fast-paced cooperative game with amazing sculpts!,150000,marvel-united,US,2866168.93,21290,USD,1583370000,1578263819,1581451202,TRUE,34,Tabletop Games,2357024,Atlanta,US,GA,1,1910.779287
1531725753,Blasphemous: Dark and brutal 2D non linear platformer,"Vanquish bloodthirsty creatures, the devotees of a twisted religion. Hand-crafted pixel art action game by the makers of The Last Door.",50000,blasphemous-dark-and-brutal-2d-non-linear-platform,US,333246.79,9869,USD,1498064400,1493376469,1495549329,TRUE,35,Video Games,774508,Seville,ES,Andalusia,1,666.49358
1197846532,Viking Horde: A Paper-craft Game,"Fold and Play! Combining art and paper design with accessible gameplay, this project brings the joy of a paper game to everyone.",3500,viking-horde-a-paper-craft-game,AU,15704,245,AUD,1386895525,1382498012,1384303525,TRUE,34,Tabletop Games,1102670,Hobart,AU,TAS,0.73662709,448.6857143
1368412031,Root: The Underworld Expansion,"Return to the world of Root with new factions, maps, and an alternative game deck!",25000,root-the-underworld-expansion,US,1726461,20886,USD,1554260400,1547416855,1552572006,TRUE,34,Tabletop Games,2487129,St. Paul,US,MN,1,6905.844
130130490,Enochian Angel Ritual Magic Occult Esoteric Ceremonial Tools,"Tools for Angelic Golden Dawn style Enochian Magick, based on the work of John Dee, Edward Kelley, and later Aleister Crowley",3500,enochian-ritual-tools,US,10273,65,USD,1585972881,1580352625,1582779681,TRUE,34,Tabletop Games,2458101,New Brunswick,US,NJ,1,293.5142857
1801275510,Zombicide: Green Horde,"The medieval fantasy Zombicide saga continues with a horde of undead orcs, new environment features, resources and challenges!",300000,zombicide-green-horde,US,5004614.58,27236,USD,1498604400,1495467112,1496170760,TRUE,34,Tabletop Games,2357024,Atlanta,US,GA,1,1668.20486
772779258,Spaceteam Admiral's Club **Relaunch**,Support free independent games from the creator of Spaceteam!,80000,spaceteam-admirals-club-relaunch,CA,83235.33,2016,CAD,1404705540,1401064275,1401898146,TRUE,35,Video Games,3534,Montreal,CA,QC,0.7647932,104.0441625
124388673,Infamy: Welcome to The Big Smoke,An action-packed skirmish game and range of steampunk miniatures. Join the revolution and battle across an alternate Victorian London!,10000,infamy-welcome-to-the-big-smoke,GB,94717.87,897,GBP,1407708000,1368063055,1405018832,TRUE,34,Tabletop Games,30720,Nottingham,GB,England,1.33559137,947.1787
2091429198,Board Games: Now Blind Accessible,Card sleeves and accessories with braille text enable blind gamers to enjoy the same games as their sighted friends.,7500,board-games-now-blind-accessible,US,20318.5,731,USD,1398370130,1391739983,1395778130,TRUE,34,Tabletop Games,2430835,Katy,US,TX,1,270.9133333
296421368,Do Move Say,"Do Move Say is a party game for ten or more people, in which everyone becomes a character in a wacky (but dangerous) world.",15000,do-move-say-0,US,15081.01,435,USD,1343603731,1340205392,1340666131,TRUE,34,Tabletop Games,2459115,New York,US,NY,1,100.5400667
1476533791,Emerald,"Reactivate a derelict spaceship in zero-G. Experience memories from your past. A story-based action-adventure game for PC, Mac & Linux.",5800,emerald,CA,10675.43,544,CAD,1381968197,1375727118,1379376197,TRUE,35,Video Games,9807,Vancouver,CA,BC,0.7647932,184.0591379
1212099537,The Titan Series,A series of gateway games by the world’s greatest game designers—perfect for introducing your friends to your favorite hobby!,135000,the-titan-series,US,203018,1415,USD,1433037621,1416250026,1427853621,TRUE,34,Tabletop Games,2479651,Redmond,US,WA,1,150.3837037
1697266516,Someone Has Died - a silly game about serious business,Someone Has Died is an improvisational storytelling game set at a will arbitration.,15000,someone-has-died-a-silly-game-about-serious-busine,US,52283.7,1712,USD,1507838400,1491589597,1504798961,TRUE,34,Tabletop Games,2459115,New York,US,NY,1,348.558
456371038,Mars Needs Mechanics: Steam Engineers Bound for Space,"London, 1873: A handful of elite steam engineers vie for a seat on mankind's first rocket to Mars.",30000,mars-needs-mechanics-steam-engineers-bound-for-spa,US,45340.65,755,USD,1349668740,1345512304,1346434998,TRUE,34,Tabletop Games,2480894,Richmond,US,VA,1,151.1355
1404189412,Ryuutama - Natural Fantasy Role-Playing Game,"Ryuutama is an original Japanese heartwarming tabletop RPG of travel and wonder, currently being translated for release in English!",8000,ryuutama-natural-fantasy-role-playing-game,US,97960.79,2056,USD,1387137600,1357754922,1383434395,TRUE,34,Tabletop Games,2394734,Durham,US,NC,1,1224.509875
779738724,Chaos Reborn - From the Creator of the Original X-COM,"Fast Paced, Fun, Tactics RPG with Monsters, Magic and Mayhem - Online Multiplayer, Rankings, Co-op, and a Huge Single Player Campaign",180000,chaos-reborn-from-the-creator-of-the-original-x-co,US,210854.53,5051,USD,1397721519,1383565320,1395043119,TRUE,35,Video Games,839722,Sofia,BG,Sofiya-Grad,1,117.1414056
1803366943,The Banner Saga,"A mature, story-driven, turn-based strategy game steeped in viking culture, by three game industry veterans.",100000,the-banner-saga,US,723886.92,20042,USD,1334962800,1331240139,1332133621,TRUE,35,Video Games,2357536,Austin,US,TX,1,723.88692
1136606488,Wrong Chemistry,The Mad Scientists are out and decided to alter the nature of the elements. Prepare yourself for a Game of Mad Science!,8500,wrong-chemistry,US,15195,382,USD,1341061703,1334386628,1335877703,TRUE,34,Tabletop Games,2394632,Dupont,US,WA,1,178.7647059
2056588422,"Hand of Fate, a card game that comes to life","Hand of Fate brings card gaming to video game life.  An infinitely replayable series of quests; build your deck, then try to defeat it!",50000,hand-of-fate-a-card-game-that-comes-to-life,AU,54095,1395,AUD,1386928800,1382670875,1384297379,TRUE,35,Video Games,1100661,Brisbane,AU,QLD,0.73662709,108.19
125414467,Zoneplex - A Board Game Adventure in an Alien Pyramid,Explore an alien pyramid at the edge of a black hole and face the ethereal creatures within. Only one can win and control the Zonep!ex!,12000,zoneplex-a-board-game-adventure-in-an-alien-pyrami,US,13459.65,219,USD,1330162785,1321902496,1327311585,TRUE,34,Tabletop Games,2442047,Los Angeles,US,CA,1,112.16375
1901440175,Customizable 3D Printed Tabletop Miniatures,A service that lets you customize your perfect miniature using our web UI and have it 3D printed just for you!,95000,customizable-3d-printed-tabletop-miniatures,US,360403.27,5189,USD,1392696000,1383181288,1389639598,TRUE,34,Tabletop Games,2488892,Santa Monica,US,CA,1,379.3718632
1269001640,"Auro: A turn-based, cross-platform tactics game","Auro is a turn-based dungeon-crawling strategy game for iOS, Android, Windows and other platforms.",7500,auro,US,14571.34,814,USD,1340993966,1337989957,1338401966,TRUE,272,Mobile Games,2411841,Goldens Bridge,US,NY,1,194.2845333
552349961,Ph. D. The Game,Ph. D. The Game is a card game that is much more fun than actual grad school.,2200,ph-d-the-game,US,4803.01,96,USD,1392517655,1387071260,1389839255,TRUE,34,Tabletop Games,2482949,Rochester,US,NY,1,218.3186364
53582201,Gnomes: The Great Sweeping Of Ammowan,"A storytelling game for families. Create shared memories of the time your family ""found gnomes living in the yard"".",1000,gnomes-the-great-sweeping-of-ammowan,US,4030,166,USD,1352995671,1347634867,1350400071,TRUE,34,Tabletop Games,2378426,Charlotte,US,NC,1,403
1378789777,RPG dice for the visually impaired,"Brailled dice do not exist, so how can a visually impaired person roll a search check? These 3D printed dice, that's how.",1000,rpg-dice-for-the-visually-impaired,US,7198,304,USD,1404669841,1401595522,1402077841,TRUE,34,Tabletop Games,2359823,Basking Ridge,US,NJ,1,719.8
1124302483,Sunrider - A Space Visual Novel/Tactical RPG,Captain your star ship and lead your squad of mecha pilots to victory.,3000,sunrider,US,44039.94,1217,USD,1388955228,1385938500,1386363228,TRUE,35,Video Games,2487889,San Diego,US,CA,1,1467.998
7127449,Castle Story,Castle Story is a voxel-based creative strategy game about building castles brick by brick and defending them against enemies.,80000,castle-story,US,702516.41,27060,USD,1345989589,1334971123,1343397589,TRUE,35,Video Games,3534,Montreal,CA,QC,1,878.1455125
748818182,DungeonCraft: Hero versus Guardian,A card game with 2 distinct roles—a Guardian who builds and protects a dungeon and a Hero who explores the dungeon in search of loot!,3000,dungeoncraft-hero-versus-guardian,US,22675,477,USD,1347851520,1343327376,1344618283,TRUE,34,Tabletop Games,2400737,Evanston,US,IL,1,755.8333333
1460337694,Codemancer: A Fantasy Game that Teaches the Magic of Code,"Aurora must learn Magic to rescue her Father, but Magic in Aurora's World works the same way that Programming works in Ours.",12000,codemancer-a-fantasy-game-that-teaches-the-magic-o,US,52725.43,1862,USD,1401249717,1380661819,1398657717,TRUE,35,Video Games,2379574,Chicago,US,IL,1,439.3785833
443570420,Shipwrights of the North Sea,"Shipwrights is a Viking themed game for 2-5 players, competing to build the greatest fleet on the North Sea!",8000,shipwrights-of-the-north-sea,NZ,73642.18,1301,NZD,1394758800,1392062727,1392170031,TRUE,34,Tabletop Games,28643034,Kapiti,NZ,Otago,0.67391802,920.52725
613333271,Dominion Storage Case,"Store all of your Dominion cards in one place!  Sleeveless or sleeved, you can go from setup to game play in record time.",8300,dominion-storage-case,US,20512,184,USD,1374769834,1369173797,1372177834,TRUE,34,Tabletop Games,2487956,San Francisco,US,CA,1,247.1325301
1740660742,Durance,"Durance is Jason Morningstar’s take on life in a far-future penal colony. It's a fast-paced, low-prep, collaborative tabletop game.",5000,durance,US,27458.51,639,USD,1341288000,1332275183,1339507462,TRUE,12,Games,2378134,Chapel Hill,US,NC,1,549.1702
665443427,Marrying Mr. Darcy - the Pride and Prejudice Card Game,"Marrying Mr. Darcy is a role-playing/strategy card game for 2-6 players, based on Jane Austen's novel “Pride and Prejudice.”",10000,marrying-mr-darcy-the-pride-and-prejudice-card-gam,US,57774.8,1679,USD,1382019131,1378241493,1379427131,TRUE,34,Tabletop Games,2449453,Menomonie,US,WI,1,577.748
898109428,Tahiti - board game,A gateway Euro style pickup and deliver game based on random hex tiles.,10000,tahiti-board-game,US,24148.28,635,USD,1340081940,1332457577,1336683236,TRUE,34,Tabletop Games,2451822,Milwaukee,US,WI,1,241.4828
1792365734,Mathematician's Dice,"Rather than the boring numbers 1 to 6, these dice have the six most important numbers in mathematics on them — i, 0, 1, φ, e and π!",2200,mathematicians-dice,US,19620.22,1228,USD,1298480481,1295577923,1295888481,TRUE,34,Tabletop Games,2487956,San Francisco,US,CA,1,891.8281818
1570047294,Pixel Dungeon Paper Miniatures,Print and play retro style pixel art miniatures for tabletop gaming,800,pixel-dungeon-paper-miniatures,US,1786,57,USD,1370127644,1360203556,1367535644,TRUE,34,Tabletop Games,2444777,Manhattan Beach,US,CA,1,223.25
127494612,Reaper Miniatures Bones II: The Return Of Mr Bones!,Reaper Miniatures Bones II is a project to continue the expansion of Reaper's Bones line of high-quality plastic gaming miniatures.,30000,reaper-miniatures-bones-ii-the-return-of-mr-bones,US,3169610.66,14964,USD,1382828400,1379173015,1380636034,TRUE,34,Tabletop Games,2391231,Denton,US,TX,1,10565.36887
1626525051,Sheltered,Family comes first. Protect your family after the nuclear aftermath in an underground shelter in this strategy survival game.,15000,sheltered,GB,30148.4,3366,GBP,1404507984,1400760324,1401915984,TRUE,35,Video Games,34757,Shrewsbury,GB,England,1.33559137,200.9893333
879309408,The Wonderful 101: Remastered,"PlatinumGames' classic Unite Action Game, self-published and heading to multiple platforms!",5425000,the-wonderful-101-remastered,JP,235320528,33199,JPY,1583524800,1569311377,1580760027,TRUE,35,Video Games,15015370,Osaka-shi,JP,Osaka Prefecture,0.00947795,4337.705585
473155549,Codename Cygnus - an Interactive Radio Drama for iOS,Play as a secret agent in an interactive fictional world inspired by old time radio dramas.,11000,codename-cygnus-an-interactive-radio-drama-for-ios,US,13943.25,469,USD,1376258400,1372995219,1374078568,TRUE,272,Mobile Games,2367105,Boston,US,MA,1,126.7568182
1445716595,Empire: The Game of New York,Risk® style battle game set in NYC. Learn fun facts about New York while you play.,15000,empire-the-game-of-new-york,US,21825,354,USD,1402775860,1397591600,1400183860,TRUE,34,Tabletop Games,12589335,Brooklyn,US,NY,1,145.5
1058821097,OMORI,"A surreal, exploration, horror RPG. Travel between new (old) worlds and uncover new (old) mysteries with your new (old) friends! ♥",22000,omori,US,203300.76,5910,USD,1401997210,1376555294,1398109210,TRUE,35,Video Games,2442047,Los Angeles,US,CA,1,924.0943636
1088180314,Rebuild: Gangs of Deadsville,"It's Sim City meets The Walking Dead. Rebuild civilization one building at a time in this strategy game for Win, Mac, iOS, & Android.",25000,rebuild-gangs-of-deadsville,CA,41330.58,2226,CAD,1383278400,1377097710,1380626876,TRUE,35,Video Games,9807,Vancouver,CA,BC,0.7647932,165.32232
776663926,"Antidote - A Game of Deduction, Deception and Mortality",A toxin is running through your veins. Can you deduce the Antidote before it's too late? A deadly-fun card game for 2-6 players.,12500,antidote-a-game-of-deduction-deception-and-mortali,US,45157,2271,USD,1405814400,1391566529,1403184521,TRUE,34,Tabletop Games,2374855,Carbondale,US,IL,1,361.256
946232321,HomeMake,Explore an endless urban planetoid by transferring your mind between bodies in this platform adventure game.,15000,homemake,US,18842.91,380,USD,1404968340,1397584379,1402355009,TRUE,35,Video Games,2442047,Los Angeles,US,CA,1,125.6194
694702650,Teramyyd: Earthsphere,An epic steampunk/fantasy/monster-fighting game of aeronautical questing! Battle sky pirates or become one in the world of Teramyyd.,20000,teramyyd-earthsphere-0,US,139243.64,1134,USD,1368496396,1361213902,1363312396,TRUE,34,Tabletop Games,2475687,Portland,US,OR,1,696.2182
1136449939,Legends of Eisenwald,Enter the world of Eisenwald in this RPG with turn-based battles and experience medieval romanticism and adventure.,50000,legends-of-eisenwald,US,83577.6,2729,USD,1337659200,1332945765,1335008996,TRUE,35,Video Games,834463,Minsk,BY,Minsk,1,167.1552
1121258628,Shovel Knight,"A groundbreaking 
love letter to 8 bits!",75000,shovel-knight,US,311502.58,14749,USD,1365908397,1355545033,1363316397,TRUE,35,Video Games,2442047,Los Angeles,US,CA,1,415.3367733
1497044919,"UNCORKED! The hilarious game of wine, wit & wordplay",UNCORKED! invites players to write entertaining tasting notes while sampling new wines. Let the wine and creative juices flow!,25000,uncorked-the-hilarious-game-of-wine-wit-and-wordpl,US,28400,533,USD,1393218000,1386912630,1389978110,TRUE,12,Games,2442047,Los Angeles,US,CA,1,113.6
653966056,Grave: Open World Survival Horror,"Grave is an open-world, surrealist survival horror experience set in a constantly changing reality.",30000,grave-open-world-survival-horror,US,37622.25,1111,USD,1398661200,1386570351,1395695728,TRUE,35,Video Games,2471390,Phoenix,US,AZ,1,125.4075
1678316557,IRON & ALE,"A Dwarven Drinking Card Game. Mine, Fight Monsters and Challenge your Friends to Real Dwarven Feats of Strength.",17500,iron-and-ale-0,US,26677,749,USD,1386424178,1380216134,1383832178,TRUE,34,Tabletop Games,2487889,San Diego,US,CA,1,152.44
787745955,Dwarven Adventurers Box Set,"The Dwarven Adventurers Project will produce a set of dwarven hero miniatures for dungeon-crawling, RPGs and 28mm tabletop wargames.",1250,dwarven-adventurers-box-set,US,136487.99,1712,USD,1343248054,1339120909,1340656054,TRUE,34,Tabletop Games,2497280,Spanish Fork,US,UT,1,10919.0392
266224330,"Limit Theory: An Infinite, Procedural Space Game","An RPG, RTS, and sandbox space exploration game all-in-one.  Explore, trade, build, and fight in a beautiful, procedural universe.",50000,limit-theory-an-infinite-procedural-space-game,US,187865.55,5449,USD,1356224400,1346799266,1353444574,TRUE,35,Video Games,2498941,Stanford,US,CA,1,375.7311
1351463795,OVA: The Anime Role-Playing Game,Become your favorite characters from the diverse worlds of Japanese animation in this easy to learn role-playing game.,7500,ova-the-anime-role-playing-game,US,112080.16,2319,USD,1371502800,1336961490,1368019911,TRUE,34,Tabletop Games,2458833,New Orleans,US,LA,1,1494.402133
1282055095,The Marble Game!,"This 4 player Party/Family game is Fast, Fun and always Hilarious. Perfect for all family gatherings or any age party. Watch the Video!",1000,the-marble-game,US,5830,70,USD,1401339600,1389942925,1398748605,TRUE,34,Tabletop Games,2436704,Las Vegas,US,NV,1,583
721110640,AdvertCity,"A cyberpunk advertising tycoon strategy game, set in massive procedurally generated cities with a retro vision of cyberspace.",1200,advertcity,GB,4477.52,211,GBP,1397516460,1394981510,1395784926,TRUE,35,Video Games,12602158,Greater Manchester,GB,England,1.33559137,373.1266667
1431101612,We Are Dead: Zombie Mall Massacre Board Game,"We Are Dead is a zombie themed board game where the players are the zombies. With art from current Simpsons Illustrator, Mike Morris.",25000,we-are-dead-zombie-mall-massace-board-game,US,42790.83,786,USD,1353301200,1328125144,1349827986,TRUE,34,Tabletop Games,2406303,Fountain Valley,US,CA,1,171.16332
2026856017,Monsters & Knights card game,Monsters and Knights is a table top card game for 2-6 players. Compete to slay the most monsters or eat the most knights.,2500,monsters-and-knights-card-game,US,5001,260,USD,1397070622,1390328934,1394478622,TRUE,34,Tabletop Games,2359460,Barnstable,US,MA,1,200.04
1906440675,The Red Solstice,"Squad based coop SF strategy/RPG and epic single player campaign, set on Mars colony during the huge storm",50000,the-red-solstice,US,60836.67,1504,USD,1397982686,1381927365,1395390686,TRUE,35,Video Games,851128,Zagreb,HR,Grad Zagreb,1,121.67334
149953700,Sui Generis,Sui Generis is an original open world RPG for the PC featuring dynamic story and physics based gameplay.,150000,sui-generis,GB,160055.85,6931,GBP,1354242724,1349966586,1351647124,TRUE,35,Video Games,44418,London,GB,England,1.33559137,106.7039
1155381356,Pulse - Reveal the world through sound,Pulse is a first person survival game that takes place in an unseen world revealed only by sound.,75000,pulse-reveal-the-world-through-sound,US,80977.69,2129,USD,1365735600,1360622868,1362686869,TRUE,35,Video Games,9807,Vancouver,CA,BC,1,107.9702533
1556821907,River City Ransom: Underground,"An officially licensed, North American follow-up to one of the most beloved RPG beat'em ups of all time.",180000,river-city-ransom-underground,CA,217643.2,5179,CAD,1381337992,1375735751,1378745992,TRUE,35,Video Games,23399724,Ottawa South,CA,ON,0.7647932,120.9128889
1046582363,Fate Core,Characters live at the core of Fate! Fate Core is the latest edition of Evil Hat Productions' popular Fate roleplaying game system.,3000,fate-core,US,433365.57,10103,USD,1359518400,1350417743,1354597047,TRUE,34,Tabletop Games,2421838,Hillandale,US,MD,1,14445.519
1230305134,Monsterhearts Second Skins,"Six additional playbooks for Monsterhearts! The Sasquatch, The Wyrm, The Cuckoo, The Unicorn, and two more!",4000,monsterhearts-second-skins,US,12395,603,USD,1371412800,1360353758,1368830396,TRUE,34,Tabletop Games,2465478,Olympia,US,WA,1,309.875
1212702147,Valdis Story: Abyssal City,Valdis Story: Abysal City is a sidescrolling exploration platformer with an emphasis on intricate and rewarding combat.,8000,valdis-story-abyssal-city,US,49574.14,2505,USD,1335575867,1330539133,1332983867,TRUE,35,Video Games,12589352,Queens,US,NY,1,619.67675
797546800,Robot Turtles: The Board Game for Little Programmers,Robot Turtles is the the most-backed board game in Kickstarter history. It sneakily teaches programming fundamentals to kids ages 3+.,25000,robot-turtles-the-board-game-for-little-programmer,US,631230.58,13765,USD,1380326400,1370246748,1378220497,TRUE,34,Tabletop Games,2490383,Seattle,US,WA,1,2524.92232
668962165,The Queen's Cavaliers RPG,"A Baroque, Clockpunk Tabletop Fantasy Roleplaying Game",4000,the-queens-cavaliers-rpg,US,19135.35,590,USD,1402038781,1375240915,1399446781,TRUE,34,Tabletop Games,2496595,South Pasadena,US,CA,1,478.38375
1533428715,Borogove - A Wonderland Card Game!,"Wabe the gimbles, friend! A unique card game based off the nonsense words and imagery of Lewis Carroll's Alice in Wonderland series.",5500,borogove-a-wonderland-card-game,US,30033.52,1507,USD,1316452597,1310796448,1313860597,TRUE,34,Tabletop Games,2475687,Portland,US,OR,1,546.064
90870929,Storm Hollow,Story Realms encourages friends and family of all ages to play thrilling stories and grand fantasy adventures in about an hour.,20000,story-realms,US,87757,887,USD,1349409540,1343706560,1346406068,TRUE,34,Tabletop Games,2400539,Eugene,US,OR,1,438.785
1911499321,SolForge Digital Trading Card Game,The creators of Ascension and Magic: The Gathering have joined forces to create a revolutionary digital trading card game.,250000,solforge-digital-trading-card-game,US,429715.49,6971,USD,1347318420,1342748022,1343836864,TRUE,35,Video Games,2464118,Oceanside,US,CA,1,171.886196
179140598,Carmageddon: Reincarnation,Carmageddon: Reincarnation is a brand new points-for-pedestrians driving game from the indie dev team behind the smash hit PC original.,400000,carmageddon-reincarnation,US,625143.46,15736,USD,1339038000,1330523677,1336488769,TRUE,35,Video Games,12696149,Isle of Wight,GB,England,1,156.285865
941890528,Widget - The Card Game That Lets You Play With Your Words,"Build crazy machines with ridiculous words in a fast, easy card game where 47 different artists illustrated the cards!",4000,widget-the-card-game-that-lets-you-play-with-your,US,6575,193,USD,1365285480,1355526931,1362697080,TRUE,34,Tabletop Games,2400052,Erie,US,PA,1,164.375
1379856018,Run An Empire - The Real-World Territory Control Game,A smartphone game where you compete against others to capture territory in your local environment.,15000,run-an-empire-the-real-world-territory-control-gam,GB,23067.41,1825,GBP,1397545147,1389651087,1394521147,TRUE,35,Video Games,23416974,Greater London,GB,England,1.33559137,153.7827333
698935995,Mobile Frame Zero: Rapid Attack,An indie tabletop wargame of tiny giant LEGO® robots battling across your  tabletop! by Vincent Baker & Joshua A.C. Newman.,9000,mobile-frame-zero-rapid-attack,US,82499.83,2639,USD,1334203140,1321468756,1330960143,TRUE,34,Tabletop Games,2461848,Northampton,US,MA,1,916.6647778
1858284007,GKR: Heavy Hitters,"The near-future is here, and Earth’s abandoned cities are now battlegrounds for the ultimate spectator sport: GIANT KILLER ROBOTS!",100000,gkr-heavy-hitters,US,935010,6598,USD,1490410800,1461870038,1487783458,TRUE,34,Tabletop Games,2351310,Wellington,NZ,Wellington,1,935.01
