ID,Name,Blurb,Goal,Slug,Country,Pledged,Backers_count,Currency,Deadline,Created_at,Launched_at,Staff_pick,Category_id,Category_name,Location_id,Location_name,Location_country,Location_state,fx_rate,Percent_funded
294405663,Nights of Payne Town: a new story arc for City of Mist RPG!,"Hit the streets of a neon-noir city as detectives and vigilantes with legendary powers! A new story arc, rulebooks, expansion, and more",20000,nights-of-payne-town-a-new-story-arc-for-city-of-m,US,182969.8,1773,USD,1535774340,1533575986,1534172226,TRUE,34,Tabletop Games,2367105,Boston,US,MA,1,914.849
1830697394,Littlebox RPGs: two complete story games in two little boxes,"Two no-prep, immersive, storytelling games you can take anywhere.  Open the box and start playing!",20000,littlebox-rpgs-two-complete-story-games-in-two-little-boxes,AU,55228.32,766,AUD,1591671600,1586737053,1590011975,TRUE,34,Tabletop Games,1105779,Sydney,AU,NSW,0.73662709,276.1416
1018515104,Sleeping Gods,"An immense, open-world, storybook game from Ryan Laukat.",50000,sleeping-gods,US,1142511.89,12056,USD,1567119600,1533769386,1565100046,TRUE,34,Tabletop Games,2488558,Sandy,US,UT,1,2285.02378
237062765,Thunderstone Quest Back to the Dungeon from AEG,"Mike Elliott's deckbuilding game of heroic adventure returns, and now features Barricades Mode for Solo & CoOp play!",50000,thunderstone-quest-back-to-the-dungeon-from-aeg,US,731383,6916,USD,1534550400,1529773450,1531843224,TRUE,34,Tabletop Games,2487886,San Clemente,US,CA,1,1462.766
318996367,Project Scissors: NightCry,"A brand new horror game from Hifumi Kono, the creator of the Clock Tower game series, and Takashi Shimizu, the director of The Grudge.",300000,project-scissors-nightcry,US,314771.85,2408,USD,1424678394,1421998127,1422086394,TRUE,35,Video Games,1118370,Tokyo,JP,Tokyo Prefecture,1,104.92395
2126939137,Epic Jungle with Star Realms High Alert Add-Ons,"New Starter Deck and packs for Epic! All the amazing constructed, sealed and draft play of a TCG without the high cost or random cards!",50000,epic-jungle-with-star-realms-high-alert-add-ons,US,234135,4089,USD,1568944800,1560979259,1566914702,TRUE,34,Tabletop Games,2406819,Framingham,US,MA,1,468.27
299287174,Valor & Villainy: Minions of Mordak,"Roast the world as the Evil Wizard, or band together and drop the hammer of justice in this zany RPG board game for 2-6 players!",15000,valor-and-villainy-minions-of-mordak,US,311059,4998,USD,1550278800,1536367281,1548176568,TRUE,34,Tabletop Games,2442047,Los Angeles,US,CA,1,2073.726667
1111932948,"Pijin: Flock, talk & unlock the sensory puzzles of speech",Phonetic Scrabble meets Apples-to-Apples! Pijin is an exciting game of quick-witted phonetic spelling & word associations!,15000,pijin-the-spelling-game-of-the-spoken-word,US,17233,205,USD,1395098611,1386621406,1392164611,TRUE,34,Tabletop Games,2475687,Portland,US,OR,1,114.8866667
1728595552,Fata Deum: The God Game Genre is Back!,With the Power of a God - Who Will You Become?,40000,fata-deum-the-god-game-genre-is-back,DE,59258.42,1451,EUR,1588536000,1580205450,1585484940,TRUE,35,Video Games,664247,Jüchen,DE,North Rhine-Westphalia,1.19112989,148.14605
1037472507,Dashkin: a game of high speed challenges through Brackenwood,"Free to play, ""Dashkin"" is a high-speed game based on the award-winning Brackenwood series of Flash movies by Adam Phillips.",20000,dashkin-a-game-of-high-speed-challenges-through-br,US,27333.33,483,USD,1313555483,1309915385,1310704283,TRUE,35,Video Games,2357536,Austin,US,TX,1,136.66665
1304131849,Moonlighter - ARPG with rogue-lite and shopkeeping elements,"An Action RPG with rogue-lite elements about Will, a shopkeeper who dreams of becoming a hero.",40000,moonlighter,US,134276.09,5229,USD,1467531032,1462281266,1464679832,TRUE,35,Video Games,776688,Valencia,ES,Valencia,1,335.690225
1663592630,Crossroads Inn - a fantasy tavern simulator.,"Develop Your tavern and dare to seize the crown one day!
Platforms: PC, MAC and Xbox One.
Available soon on Steam, GOG and Humble Store",30000,crossroads-inn-a-fantasy-tavern-simulator,US,38641.22,1265,USD,1552578984,1540455211,1549990584,TRUE,35,Video Games,523920,Warsaw,PL,Masovian,1,128.8040667
1535273700,Project Grove | 3D puzzle-platformer,Explore an ancient forest and harness its powerful magic with steampunk technology.,29200,project-grove,GB,30015.05,419,GBP,1583020740,1570394106,1580231300,TRUE,35,Video Games,31278,Oxford,GB,England,1.33559137,102.7912671
623943939,Pretending to Grownup,A casual card game for grownups who feel like they're pretending.,6000,pretending-to-grownup,CA,220266.74,5988,CAD,1477922762,1474243708,1475503562,TRUE,34,Tabletop Games,4118,Toronto,CA,ON,0.7647932,3671.112333
1469611628,Transport INC. Real-world map data in a transport game!,A transport company simulator challenging your skills on moving passengers and cargo over real-world maps!,10000,transport-inc-real-world-map-data-in-a-transport-game,CA,10328.29,431,CAD,1577030584,1569110575,1574438584,TRUE,35,Video Games,821207,Nitra,SK,Nitriansky,0.7647932,103.2829
351266664,LIFE SIPHON,"In this combat strategy game for 2-4 players, you are cursed humans, battling underground.",10000,life-siphon,US,136092,2081,USD,1555646340,1547361004,1552921210,TRUE,34,Tabletop Games,2367105,Boston,US,MA,1,1360.92
77133348,Party of Sin,"Play as the 7 Deadly Sins in this coop adventure. Fight your way from Hell to Heaven, solve puzzles and battle legions of angels.",8000,party-of-sin,US,16571.66,356,USD,1330748626,1326167221,1327119826,TRUE,35,Video Games,2355942,Arlington,US,VA,1,207.14575
1104914153,Liege,"Story, Tactics, and Art. A modern re-imagining of the classic 16-bit RPG.",15000,liege,US,81458.51,2918,USD,1375063200,1354919068,1372365853,TRUE,35,Video Games,2459115,New York,US,NY,1,543.0567333
1913106610,Assassin's Creed®: Brotherhood of Venice,The story driven cooperative miniatures board game in the Assassin's Creed® universe,130000,assassins-creed-brotherhood-of-venice,CA,1391215.28,6762,CAD,1544137200,1523572085,1542127573,TRUE,34,Tabletop Games,3534,Montreal,CA,QC,0.7647932,1070.1656
2064718956,Clorehaven & the Goblin Grotto,Design your own 3D printable buildings and underground caverns with 3D printable scenery for wargames and RPG,500,clorehaven-and-the-goblin-grotto,NZ,363170.42,2307,NZD,1565722800,1561514000,1563888121,TRUE,34,Tabletop Games,2351310,Wellington,NZ,Wellington,0.67391802,72634.084
2086755272,Village Monsters - A Monstrous Life Sim Game,"Escape to a carefree and colorful village where the monsters are your friends. For PC, Mac and Linux.",16000,village-monsters-a-monstrous-life-sim-game,US,17106.26,412,USD,1507831885,1501303912,1505239885,TRUE,35,Video Games,2490383,Seattle,US,WA,1,106.914125
1839304671,"Indie Nerd Board Game, Needs Player Character Miniature Sculpted!  ","pictured here is the character we would like to sculpt as a high quality game miniature - the Forsaker, a man that has abandoned his sanity to face..",1500,indie-nerd-board-game-needs-hero-miniature-sculpted,US,1741.02,28,USD,1245042600,1242364202,1242369560,TRUE,34,Tabletop Games,2459115,New York,US,NY,1,116.068
2056303761,Dice Throne Adventures & Season One: Rerolled!,"A cooperative & solo campaign inspired by Diablo, with exploration, gold, treasure, upgrades, minions, & epic boss battles!",80000,dice-throne-adventures-and-season-one-rerolled,US,1735944.19,11674,USD,1565323200,1562270968,1563292876,TRUE,34,Tabletop Games,2497646,Spokane,US,WA,1,2169.930237
1709715584,Unpub - The Unpublished Games Network,"Help support Unpub and Unpub 5, the annual unpublished gaming event showcasing the best games of tomorrow- today!",4000,unpub-the-unpublished-games-network,US,9383,307,USD,1406951940,1330658989,1404752418,TRUE,34,Tabletop Games,2358820,Baltimore,US,MD,1,234.575
1174178628,Tabula,"Tabula is a wooden board game, designed to be its own box, and a beautiful aesthetic addition to the home.",10000,tabula-the-game,US,16125,182,USD,1406478965,1401674392,1403886965,TRUE,34,Tabletop Games,2459115,New York,US,NY,1,161.25
975435216,Inkulinati - a turn-based strategy with medieval animals,Become a master of the Living Ink and lead your illustrated animal army on the pages of medieval books.,20000,inkulinati,US,73329,2349,USD,1593096975,1588516526,1590504975,TRUE,35,Video Games,523920,Warsaw,PL,Masovian,1,366.645
1220581981,Woe to the Living; the game of classic pulp horror,“Revitalizing art from the pulp era in a haunting horror game that also serves as a standard poker deck.”,1000,woe-to-the-living-the-game-of-classic-pulp-horror-0,US,5940,307,USD,1331877540,1329454557,1329461513,TRUE,34,Tabletop Games,2487610,Salt Lake City,US,UT,1,594
2086393351,Chained Echoes - a 16bit fantasy RPG with mechs and airships,A classic JRPG adventure that combines a fantasy world full of magic with mechs and airships.,60000,chained-echoes-a-16bit-fantasy-rpg-with-mechs-and,DE,130409.97,4655,EUR,1551996000,1529582976,1549368002,TRUE,35,Video Games,646099,Dusseldorf,DE,North Rhine-Westphalia,1.19112989,217.34995
1591660853,Grandroids: Real artificial life on your PC,"I'm creating the world's most advanced artificial creatures, for people to look after, interact with and study.",27000,grandroids-real-artificial-life-on-your-pc,US,56818.55,579,USD,1302373106,1298334638,1298830706,TRUE,35,Video Games,2404049,Flagstaff,US,AZ,1,210.4390741
604672591,Unforgotten Quest,"Unforgotten Quest, a 2D CO-OP RPG. Loot, Levels, Skills, Classes, Quests, Bosses, Humor, Multiplayer, and most importantly, Time eater!",100000,unforgotten-quest,US,118824.46,1310,USD,1355877742,1351962685,1353285742,TRUE,35,Video Games,4063,London,CA,ON,1,118.82446
879026369,Night of the Dead 2,A free to play cooperative survival game available on the Starcraft II Arcade (no Starcraft II purchase necessary).,5000,night-of-the-dead-ii,US,7494.69,145,USD,1389919535,1386014803,1387241135,TRUE,35,Video Games,2458030,New Berlin,US,WI,1,149.8938
1064775552,Barbarians of Lemuria: Mythic Edition,"Barbarians of Lemuria: Mythic Edition - fast, rules-lite, sword and sorcery roleplaying in the Lands of Lemuria.",2000,barbarians-of-lemuria-mythic-edition,GB,8356.5,488,GBP,1407700800,1403628210,1404944700,TRUE,34,Tabletop Games,32185,Plymouth,GB,England,1.33559137,417.825
1428354446,The Few and Cursed: Board Game,"A curse chasing adventure game where 1 to 6 players collect powerful artifacts, complete jobs,capture bounties and defeat monsters!",50000,the-few-and-cursed-board-game,US,135083.28,2378,USD,1561690800,1548783504,1559649538,TRUE,34,Tabletop Games,2471217,Philadelphia,US,PA,1,270.16656
46656588,Hourglass - an atmospheric first-person puzzle adventure,"Discover egyptian technologies, solve challenging puzzles by manipulating time and explore an ancient world",37800,hourglass-an-atmospheric-first-person-puzzle-adventure,DE,41050.59,810,EUR,1568030411,1561218927,1565179211,TRUE,35,Video Games,648820,Essen,DE,North Rhine-Westphalia,1.19112989,108.5994444
1153781841,Planet Apocalypse,An exciting co-op board game in which post-apocalypse heroes confront the hordes of Hell.,100000,planet-apocalypse,US,514427,2498,USD,1519696800,1513636246,1517243867,TRUE,34,Tabletop Games,2483565,Rockwall,US,TX,1,514.427
1773559710,The Adventurer's Guide to Theria Volume 1: Ellara,"A ""Dungeons and Randomness"" podcast setting book.",65000,the-adventurers-guide-to-theria-volume-1-ellara,US,87006.69,620,USD,1558366253,1551462580,1555774253,TRUE,34,Tabletop Games,2357282,Auburn,US,CA,1,133.8564462
1669948790,Unknown Armies Third Edition Roleplaying Game,A new edition of the occult tabletop game about broken and obsessed people risking everything to change the world.,40000,unknown-armies-third-edition-roleplaying-game,US,266084.45,2819,USD,1461958405,1458757086,1459366405,TRUE,34,Tabletop Games,2487129,St. Paul,US,MN,1,665.211125
1362527572,Atlantis: The Second Age RPG,"Atlantis: The Second Age, a tabletop role-playing game (RPG) of sword and sorcery fantasy.",6500,atlantis-the-second-age-rpg,US,14005,262,USD,1368118819,1363462146,1365526819,TRUE,34,Tabletop Games,2436704,Las Vegas,US,NV,1,215.4615385
1770573484,Dinosaurs of the Lost Valley,"Exquisite dinosaur artwork by Jeff Dee and Talzhemir, and a dinosaur sourcebook for Cavemaster(tm) - the Stone Age RPG!",2000,dinosaurs-of-the-lost-valley,US,2138,64,USD,1362760544,1359309802,1360168544,TRUE,34,Tabletop Games,2357536,Austin,US,TX,1,106.9
1696603292,ACROSS THE WORLDS - Chrono Cross Wayô Piano Collection,Album based on the music of the famous RPG created with some of the best Japanese video game artists,25000,across-the-worlds-chrono-cross-wayo-piano-collection,FR,84110,930,EUR,1594137600,1590406579,1591545749,TRUE,35,Video Games,1118370,Tokyo,JP,Tokyo Prefecture,1.19112989,336.44
1518033918,Da Share Z0ne: THE DEVIL'S LEVEL Card Game,The Devil's Level is a tabletop card game where 2+ players battle life's challenges to achieve an ultimate state of Chill.,28800,da-share-z0ne-the-devils-level-card-game,US,227250.99,3643,USD,1519215952,1514990842,1516623952,TRUE,34,Tabletop Games,2383660,Columbus,US,OH,1,789.0659375
381221868,Enemy on Board,Mafia/Werewolf’s deception meets fast-paced action combat in space. PC/Mac,20000,enemy-on-board-an-online-game-of-deception,US,51295.5,465,USD,1574355320,1566274179,1571759720,TRUE,35,Video Games,2487956,San Francisco,US,CA,1,256.4775
243682158,StelCon: Infinity,A game of interstellar exploration and conquest.,10000,stelcon-infinity,US,10951,127,USD,1333548305,1328578092,1330959905,TRUE,34,Tabletop Games,2508533,Tulsa,US,OK,1,109.51
1433533599,Guns of Icarus Online,Captain a steampunk airship and fly with your friends in this thrilling MMO air combat game set in a post-apocalyptic world.,10000,guns-of-icarus-online,US,35237.68,1211,USD,1329844474,1311889504,1324660474,TRUE,35,Video Games,2459115,New York,US,NY,1,352.3768
1354279130,Bake 'n Switch: Couch Co-Op Online with Friends,"We’re turning on online multi-player, and need you to help us test and complete it in time for launch in Summer 2020!",30000,bake-n-switch-play-apart-together,US,36288,609,USD,1591491600,1586591474,1588684085,TRUE,35,Video Games,2436704,Las Vegas,US,NV,1,120.96
319545204,Knitted Knerd Dice Bags,"Handcrafted containers for dice sets and counters in adorable, nerdy themes!",3300,knitted-knerd-dice-bags,US,7065,259,USD,1403150340,1399302718,1400598123,TRUE,34,Tabletop Games,2450978,Milford,US,CT,1,214.0909091
1140999894,Deadwood Studios USA,"Deadwood is a deluxe board game about making cowboy movies. Designed by James Ernest, with art by Phil Foglio.",35000,deadwood-studios-usa,US,50497.15,919,USD,1364958000,1361334856,1362167956,TRUE,34,Tabletop Games,2490383,Seattle,US,WA,1,144.2775714
678135527,Project Rain World,"In the ruins of an ancient alien civilization, a lonely slugcat vies to hunt and survive deadly rains in a harsh closed eco-system.",25000,project-rain-world,US,63255.39,3030,USD,1392353940,1387102052,1389657620,TRUE,35,Video Games,2367105,Boston,US,MA,1,253.02156
1707362252,DemonWars: Reformation,"DemonWars: Reformation is an old-school tabletop RPG focused on fast set-up, engaging combat and open-ended non-combat action.",50000,demonwars-reformation-0,US,88245.66,1126,USD,1377873534,1374080930,1375281534,TRUE,34,Tabletop Games,2438369,Leominster,US,MA,1,176.49132
258711332,Critical Core,"The tabletop game that helps kids on the autism spectrum build confidence and social skills, one dragon at a time.",48000,critical-core,US,244162.11,3157,USD,1556262000,1512369104,1552997059,TRUE,34,Tabletop Games,2490383,Seattle,US,WA,1,508.6710625
816980325,Evergreen Bandana Game,A Washington State themed bandana that doubles as a board game.,2500,evergreen-bandana-game,US,25231,580,USD,1591180058,1583968938,1588588058,TRUE,34,Tabletop Games,2362060,Bellingham,US,WA,1,1009.24
1109582624,Project Lodus - A Cyberpunk Co-op Action RPG,Grab some friends and fight your way through a long-since abandoned cyberpunk city in this Co-op ARPG.,50000,project-lodus-a-cyberpunk-co-op-action-rpg,US,51200.51,470,USD,1344975973,1339708090,1341951973,TRUE,35,Video Games,2453859,Moorpark,US,CA,1,102.40102
966925371,GLYPHiTS: Magnetic Pictures with Linguistic Potential,Create messages and puzzles using this set of hieroglyphic magnets.,3000,glyphits-magnetic-pictures-with-linguistic-potenti,US,23255.07,815,USD,1349198629,1342512206,1345829029,TRUE,34,Tabletop Games,2442047,Los Angeles,US,CA,1,775.169
953329192,Skywanderers,"A sci-fi sandbox game set in an immersive galaxy, with a focus on creative freedom and exploration.",15000,skywanderers,FR,43772.8,1294,EUR,1506642313,1501906736,1504050313,TRUE,35,Video Games,611111,Merignac,FR,Aquitaine,1.19112989,291.8186667
1520284650,Gype: Bringing G.K. Chesterton & H.G. Wells' Game to Life,An award-winning board game that combines Chess and Chinese Checkers with a unique twist. Made in the USA with wood pieces!,1500,gype-bringing-gk-chesterton-and-hg-wells-game-to-l,US,5912.21,145,USD,1309838340,1295733002,1305909918,TRUE,12,Games,2412843,Grand Rapids,US,MI,1,394.1473333
792084067,"Hazelnut Bastille, a 16bit Indie Adventure","Hazelnut Bastille is a topdown, Zelda-like ARPG, presented in  a rigorously-period 16 bit style.",65000,hazelnut-bastille-a-16bit-indie-adventure,US,177713.55,4828,USD,1543510740,1519292552,1540296071,TRUE,35,Video Games,2512636,Virginia Beach,US,VA,1,273.4054615
948244955,Water Dragons & Other Rare Aquatic Creatures Book & Cards,"A book, TWO decks of playing cards, & more! Water themed with dragons & other aquatic creatures including mermaids, krakens & more!",4200,water-dragons-and-other-rare-aqutic-creatures,US,13285.99,285,USD,1407708576,1402517307,1405116576,TRUE,273,Playing Cards,2508428,Tucson,US,AZ,1,316.3330952
1177268190,Adventure Maximus!,It's time for a role playing game adults & kids can both enjoy. Make a character in under 2 minutes. Start playing out of the box.,12000,adventure-maximus,US,36652,764,USD,1370365930,1364960943,1367773930,TRUE,34,Tabletop Games,2352646,Albany,US,NY,1,305.4333333
2007983179,Kelvin and the Infamous Machine,Race through time to inspire humanity’s greatest achievements in a classic point-and-click adventure!,20000,kelvin-and-the-infamous-machine,US,29122.35,1337,USD,1418382483,1389665420,1415790483,TRUE,35,Video Games,468739,Buenos Aires,AR,Autonomous City of Buenos Aires,1,145.61175
440357562,Roguebook,Roguebook aims to become the ultimate roguelike deckbuilder. Based on the legends of the Faeria universe.,60000,roguebook,BE,66810.07,2706,EUR,1562551200,1552164191,1559826627,TRUE,35,Video Games,973540,Liege,BE,Liege,1.19112989,111.3501167
793529816,Elevenses - The Card Game of Morning Tea,Elevenses is a card game in which respectable 1920s socialites strive to serve the finest morning teas!,5000,elevenses-the-card-game-of-morning-tea,AU,26535.42,1118,AUD,1387191600,1384152381,1384771951,TRUE,34,Tabletop Games,1105779,Sydney,AU,NSW,0.73662709,530.7084
2119740506,Hell Let Loose,Hell Let Loose is a platoon-based realistic multiplayer first-person shooting game for PC set during the Second World War.,136000,hell-let-loose,AU,308368.84,5284,AUD,1509372005,1478048459,1506780005,TRUE,35,Video Games,1105779,Sydney,AU,NSW,0.73662709,226.7417941
1533782482,Retro Tea Breaks 1. - A book to preserve video game history.,"Collected interviews with pioneers of the computer, console and video games industry.",6500,retro-tea-breaks-vol-1-a-book-by-retromancave,GB,66291,2014,GBP,1597336224,1593064649,1594312224,TRUE,35,Video Games,28196,Malmesbury,GB,England,1.33559137,1019.861538
1737416839,Scorn Part 1 of 2 : Dasein,An atmospheric first-person horror adventure game.,150000,scorn-part-1-of-2-dasein,AT,192487.95,5636,EUR,1507611237,1502882542,1504587237,TRUE,35,Video Games,532697,Belgrade,RS,Beograd,1.19112989,128.3253
784764836,Endless Memories | 2D action-adventure,A magical 2D action-adventure set in the world of dreams. Explore a vast dream-world to recover all your lost memories.,12000,endless-memories,US,14256,264,USD,1575561583,1570645120,1572969583,TRUE,35,Video Games,2459115,New York,US,NY,1,118.8
1991381514,Speculation,"In Speculation, by Dirk Henn, players speculate on companies to increase their fortune by trading shares for the biggest profit",10000,speculation,US,37445,505,USD,1365153600,1358211700,1362565200,TRUE,34,Tabletop Games,2388929,Dallas,US,TX,1,374.45
1449344505,Traveller 5th Edition,Traveller5 is the ultimate edition of the Traveller science-fiction role-playing game: rules and concepts you never thought possible.,24000,traveller-5th-edition,US,294628.33,2085,USD,1341162060,1337227052,1338522914,TRUE,34,Tabletop Games,2365646,Bloomington,US,IL,1,1227.618042
1199857925,Conspiracy X RPG The Extraterrestrials Sourcebook,"Project Bluebook lied to you. THEY are among us, & have been for some time. Help us find the truth with this Pen & Paper RPG sourcebook",5000,conspiracy-x-rpg-the-extraterrestrials-sourcebook,US,8191.14,141,USD,1322682816,1318603977,1318791216,TRUE,34,Tabletop Games,2352646,Albany,US,NY,1,163.8228
1313600350,Star Scrappers: Battledrill - 3D Printable Skirmish (STL),Space western skirmish wargame with lightweight rules and superb miniatures ready to 3d print at home.,3500,starscrappers-battledrill-3d-printable-skirmish-stl,US,21047,723,USD,1598349600,1595238793,1596549626,TRUE,34,Tabletop Games,523920,Warsaw,PL,Masovian,1,601.3428571
926321120,Love 2 Hate: A Party Game for Inappropriate People,"Love 2 Hate is the party game of finishing sentences. Play a card, choose love or hate, and let the fun begin!",15000,love-2-hate-a-party-game-for-inappropriate-people,US,15697,401,USD,1407546000,1404077099,1404843255,TRUE,12,Games,2490383,Seattle,US,WA,1,104.6466667
1958835100,Renaine - A Game About Overcoming Failure,"Guide Aine, the Phoenix Knight, on her impossible quest through Lineria's colorful kingdom as she sets out to avenge her friend, Ren.",5000,renaine-a-game-about-overcoming-failure,US,22307,883,USD,1525457125,1522790686,1522865125,TRUE,35,Video Games,2367105,Boston,US,MA,1,446.14
567039927,CARDS: I Think Therefore I Question,60 Questions. Countless discoveries. Infinite connections.,15000,i-think-therefore-i-question,US,20203,403,USD,1597383000,1360033811,1594749613,TRUE,271,Live Games,2442047,Los Angeles,US,CA,1,134.6866667
87819093,Tainted Grail: The Fall of Avalon,"Adventure, survival co-op Board Game set in unique grim world inspired by Arthurian Legends. Unforgettable experience for 1-4 players",40000,tainted-grail-the-fall-of-avalon,GB,4940030.59,41939,GBP,1546012791,1541761055,1544025591,TRUE,34,Tabletop Games,526363,Wroclaw,PL,Lower Silesia,1.33559137,12350.07648
2064635861,Glam Metal Monster Hunter,a Micro RPG of Neon Knights and Denim Demons in the Satanic Panic,2500,glam-metal-monster-hunter,AU,4433.32,138,AUD,1598493540,1592475891,1596237577,TRUE,12,Games,1100968,Canberra,AU,ACT,0.73662709,177.3328
903714154,Writer's Dice - Roll over writer's block!,"Dice for writers, storytellers and gamers! Use 'em to plot your next novel! Roll 'em into your RPG! Gift 'em to your gaming buddies!",1000,writers-dice-roll-over-writers-block,US,8435.39,475,USD,1320541200,1319075059,1319144255,TRUE,12,Games,2394734,Durham,US,NC,1,843.539
819700863,Sequence: A Rhythm Roleplaying Game,"Sequence is a title being developed for the Xbox Live Indie Games initiative, a unique blend of roleplaying and rhythm game elements.",600,sequence-a-rhythm-roleplaying-game,US,2602,75,USD,1272351600,1265761552,1265836362,TRUE,12,Games,2442047,Los Angeles,US,CA,1,433.6666667
1028298667,Successors,"Award-winning, World's Top 20 multiplayer political & military game. Updated, upgraded with minis and beautifully illustrated. Act now!",40000,successors,GB,314052,3898,GBP,1568401200,1561466367,1566828020,TRUE,34,Tabletop Games,44418,London,GB,England,1.33559137,785.13
103963936,Perception,A new narrative horror adventure where you play a young blind woman.  From developers of BioShock and Dead Space.,150000,perception-3,US,168041.85,4357,USD,1435237311,1427807227,1432645311,TRUE,35,Video Games,2367105,Boston,US,MA,1,112.0279
969455538,Ortus: The RPG of your dreams!,"Ortus is a massive story-focused RPG, based in a world where every choice you make results in your own unique path in the game!",20000,ortus-the-rpg-of-your-dreams,US,21740,292,USD,1324738800,1320186406,1321316388,TRUE,35,Video Games,1103816,Melbourne,AU,VIC,1,108.7
1320505459,Penny Arcade's Paint The Line ECG: Red Tide,"In Penny Arcade's expandable card game, you engage in fast and furious tabletop tennis battles to battle for your country!",3000,penny-arcades-paint-the-line-ecg-red-tide,US,9025.66,259,USD,1342065540,1341239246,1341250371,TRUE,34,Tabletop Games,2490383,Seattle,US,WA,1,300.8553333
1092580660,Afterland,"Afterland is a hand-painted, mobile card game about a traveling carnival of magical misfits in the afterlife.",32000,afterland,US,35764.01,488,USD,1372306249,1366317971,1369714249,TRUE,272,Mobile Games,3534,Montreal,CA,QC,1,111.7625313
1248761119,Dim Sum Robot #1 - mecha food cart action!,"Sell dim sum, upgrade your cart, and out-pilot the competition in this arcade-style Mecha Food Cart Simulation game!",1000,dim-sum-robot-1-mecha-food-cart-action,US,2335.5,210,USD,1359229822,1357095332,1357933822,TRUE,35,Video Games,2459115,New York,US,NY,1,233.55
1679517456,Pixel Lincoln: The Deckbuilding Game,"The 16-Bit President of the United States, starring in his very own deckbuilding game. Get ready for 8-Bit Emancipation!",5000,pixel-lincoln-the-deckbuilding-game-0,US,41229.01,814,USD,1342411140,1338699132,1338911189,TRUE,34,Tabletop Games,2522939,Woodbury,US,NJ,1,824.5802
805642804,Kumo — A boy in the clouds,An atmospheric tale of hope,13450,kumo-a-story-of-a-second-chance,GB,22071.5,781,GBP,1567267201,1558471807,1564588801,TRUE,35,Video Games,566473,Jyvaskyla,FI,Central Finland,1.33559137,164.1003717
