ID,Name,Blurb,Goal,Slug,Country,Pledged,Backers_count,Currency,Deadline,Created_at,Launched_at,Staff_pick,Category_id,Category_name,Location_id,Location_name,Location_country,Location_state,fx_rate,Percent_funded
684733990,Stygian - A Lovecraftian Computer RPG,"""Stygian: Reign of the Old Ones"" is a Lovecraftian computer roleplaying game of horror, loss and madness.",55000,stygian-a-lovecraftian-computer-rpg,DE,73742,2613,EUR,1467393151,1463918921,1464801151,TRUE,35,Video Games,2344116,Istanbul,TR,Istanbul,1.19112989,134.0763636
62471853,Super Comboman: Beat-em-up Sticker Action Platformer,"Hardcore Beat-em-Up/platformer/fighter with stylish combos, custom moves, colorful sticker characters and destructible environments.",14900,super-comboman-beat-em-up-sticker-action-platformm,US,16170.34,460,USD,1352910938,1348691327,1349969738,TRUE,35,Video Games,2487956,San Francisco,US,CA,1,108.5257718
1944334961,The Dance and the Dawn: A Theatrical Experience,A gothic fairy tale in the form of a theatrical-experience game.  Doomed nobles seek redemption through True Love at a midnight ball.,2000,the-dance-and-the-dawn-a-theatrical-experience,US,5029.13,75,USD,1315139448,1311027600,1312547448,TRUE,12,Games,2383078,College Park,US,MD,1,251.4565
92169165,Organ Trail: Director's Cut,"Organ Trail: Directors Cut. The popular edutainment game about the impending zombie apocalypse, for iOS, Android, PC & Mac.",3000,organ-trail-directors-cut,US,16339.09,495,USD,1326997236,1322793413,1324405236,TRUE,35,Video Games,2379574,Chicago,US,IL,1,544.6363333
694302577,Toejam and Earl: Back in the Groove,"Toejam and Earl is finally back!  We're goin' indie, and old skool like GAME ONE, with a fun retro-comics style, and plenty of funk!",400000,toejam-and-earl-back-in-the-groove,US,508637.69,8873,USD,1427482816,1423251979,1424894416,TRUE,35,Video Games,2352647,Albany,US,CA,1,127.1594225
1016740457,The Algernon Files 3.0,Algernon 3.0 vastly expands the original universe of characters for the Mutants & Masterminds game system.,2500,the-algernon-files-30,US,2585,117,USD,1406951940,1340744216,1404425944,TRUE,34,Tabletop Games,2442327,Louisville,US,KY,1,103.4
473182502,Tiny Epic Defenders,A Cooperative MICROGAME for 1-4 players! Follow-up to the smash hit Tiny Epic Kingdoms! Only $16!! Pledge NOW!,15000,tiny-epic-defenders,US,162372,5522,USD,1405776125,1402019510,1403184125,TRUE,34,Tabletop Games,2477737,Queen Creek,US,AZ,1,1082.48
560733349,SOVIET KITCHEN UNLEASHED* - colorful coop cooking cardgame,A cardgame about throwing colorful stuff in a meat grinder while trying not to kill anyone.,8500,soviet-kitchen-unleashed-colorful-coop-cooking-cardgame,DE,14690.6,619,EUR,1563876000,1555409315,1562080072,TRUE,34,Tabletop Games,645686,Dresden,DE,Saxony,1.19112989,172.8305882
1330090738,"Bushiden - A Futuristic, Ninja Action Platformer",Explore for cybernetic upgrades until you are powerful enough to defeat the diabolic Gaoh and his cybergenetic army once and for all!,70000,bushiden-a-futuristic-ninja-action-platformer,US,84382.5,2232,USD,1540569447,1502369862,1537977447,TRUE,35,Video Games,2418046,Harrisburg,US,PA,1,120.5464286
1591656604,Tranquility: a co-operative card game,Please help us bring to life this intense and captivating co-operative experience.,7000,tranquility-a-co-operative-card-game,GB,31852.53,2442,GBP,1575248343,1568634677,1572652743,TRUE,34,Tabletop Games,14940,Calne,GB,England,1.33559137,455.0361429
916984414,Remix games with Craftyy,"My turn. I add a new level. Your turn. You add new story. Growing a game, is the game. It's our turn.",13000,craftyy-an-online-game-creator,US,13311.16,158,USD,1348863294,1344035907,1346271294,TRUE,35,Video Games,9807,Vancouver,CA,BC,1,102.3935385
193294637,Ritual Dementia: The Revenge,"A dreadfully dark adventure of occult, horror, and family bonding.",7000,ritual-dementia-the-revenge,US,8008.14,328,USD,1365109877,1362114279,1362521477,TRUE,35,Video Games,2488042,San Jose,US,CA,1,114.402
1139444330,Mint Cooperative - The Minty Fresh Cooperative Game,Mint Cooperative puts you and your fellow superheroes to work delivering the citizens of Mintopia from the threat of periodontal peril!,10000,mint-cooperative-the-minty-fresh-cooperative-game,US,107172.5,6679,USD,1570219200,1563909091,1568037611,TRUE,34,Tabletop Games,2439482,Lincoln,US,NE,1,1071.725
377124061,The Iron Oath: Dark Turn-based Tactical RPG,A gritty turn-based RPG with a focus on tactics and the management of your guild within a dynamic world.,45000,the-iron-oath-dark-turn-based-tactical-rpg,US,94524,3835,USD,1504885217,1501716343,1502293217,TRUE,35,Video Games,2466256,Orlando,US,FL,1,210.0533333
1881115016,Dinosaur Fossil Hunter,"Become a paleontologist, discover ancient fossils, complete dinosaur skeletons and create your own unique museum.",10000,dinosaur-fossil-hunter,CA,36088.29,1238,CAD,1593359902,1587475163,1590767902,TRUE,35,Video Games,505477,Lublin,PL,Lublin,0.7647932,360.8829
292646621,nstaCharge,A Scifi Racing Game -- based on an award winning short film by the same artists.,12000,nstacharge,US,13718.23,449,USD,1335769656,1331437203,1333177656,TRUE,35,Video Games,2488867,Santa Fe,US,NM,1,114.3185833
1709119167,Deluxe Werewolf the Apocalypse 20th Anniversary Edition,"Contribute to help give the Deluxe W20 Edition a leather bound, embossed+, metallic-edged, full-color, deluxe treatment. RAGE!",85000,deluxe-werewolf-the-apocalypse-20th-anniversary-ed,US,380015,2108,USD,1351774955,1344975075,1349182955,TRUE,12,Games,2443867,Macungie,US,PA,1,447.0764706
1651266186,Ruins of Lemuria: A New World D&D Campaign Sourcebook,"A New World Campaign Supplement –  for all fantasy role playing games and compatible with 3E, Pathfinder and 4E Dungeons and Dragons. ",1650,ruins-of-lemuria-a-new-world-dandd-campaign-source,US,1936,48,USD,1293080158,1290477578,1290488158,TRUE,35,Video Games,2498315,Springfield,US,MO,1,117.3333333
1913975163,Blood Nor Water: A Tactical Strategy R.P.G.,"A tactical strategy video game, about young souls fighting in a war that’s bigger than they are.",12500,blood-nor-water-a-tactical-strategy-rpg,US,14663,232,USD,1537545591,1528130217,1534953591,TRUE,35,Video Games,2357536,Austin,US,TX,1,117.304
389633266,We're bringing NYC's best indie games to SF for a night!,Indie games? Check.  World class DJ's? Check.  A night of unforgettable entertainment celebrating NYC's vibrant indie game community.,8000,were-bringing-nycs-best-indie-games-to-sf-for-a-ni,US,10673.66,569,USD,1330732800,1328032927,1328751068,TRUE,35,Video Games,2487956,San Francisco,US,CA,1,133.42075
2068309724,Invisible Sun – Return to the Actuality,"A reprint of the radical, ambitious, critically acclaimed tabletop roleplaying game, currently sold out and unavailable.",99999,invisible-sun-return-to-the-actuality,US,339478,1505,USD,1542417420,1539269122,1540304223,TRUE,34,Tabletop Games,2490383,Seattle,US,WA,1,339.4813948
1642578010,Storyteller Cards: A Playing Card Deck To Inspire Creativity,"A deck of playing cards to help storytellers of all types: Gamers, Role Players, Writers, Artists, Children, Parents, Teachers & You!",10000,storyteller-cards-a-playing-card-deck-to-inspire-c,US,15990.11,663,USD,1370836740,1362339744,1367841700,TRUE,34,Tabletop Games,2383144,Collingswood,US,NJ,1,159.9011
847520629,Crimson Company - The Other Side (Core Game + Expansion),"The ultimate duel card game returns with its first expansion! Enter ""The Other Side"" - a realm beyond life and death!",5000,crimson-company-the-other-side-core-game-expansion,DE,35692,1470,EUR,1574938869,1562923615,1572343269,TRUE,34,Tabletop Games,676756,München,DE,Bavaria,1.19112989,713.84
111725070,Kingdom Rush: Rift In Time,A Tabletop Tower Defense Like No Other,20000,kingdom-rush-rift-in-time,US,1098416.42,11900,USD,1556834100,1550674641,1554813189,TRUE,34,Tabletop Games,502075,Krakow,PL,Lesser Poland,1,5492.0821
908935507,Anachrony: Fractures of Time Expansion and Infinity Box,Return to the world of Anachrony and change the fate of New Earth in a new expansion and the exclusive Infinity Box!,50000,anachrony-fractures-of-time-expansion-and-infinity,US,1051447,11346,USD,1557252000,1554298694,1555432838,TRUE,34,Tabletop Games,2442047,Los Angeles,US,CA,1,2102.894
1260422744,"Edge Of Eternity (Pc, Mac, Linux, PS4, XBOX ONE)","An indie tribute to J-RPG classics. Explore a universe blending fantasy with science-fiction, intense ATB battles and branching story.",44000,edge-of-eternity-pc-mac-linux-ps4-xbox-one,US,161246.54,4045,USD,1427018469,1410514781,1423998069,TRUE,35,Video Games,12659968,Nimes,FR,Languedoc-Roussillon,1,366.4694091
241606422,Tammany Hall,"Tammany Hall is a board game of backstabbing, corruption, temporary alliances and taking power at all costs.",35000,tammany-hall,US,151483.11,2392,USD,1339822740,1334501090,1335880247,TRUE,34,Tabletop Games,2357536,Austin,US,TX,1,432.8088857
657413995,"Project Biomodus - A Transhuman, Post-Apocalyptic Action RPG","Project Biomodus: a Tabletop RPG, where powerful transhuman hunters try to survive the biomechanical horrors of a dying, adapted world.",12000,project-biomodus-a-transhuman-post-apocalyptic-act,US,13035,252,USD,1478070394,1467591165,1475478394,TRUE,34,Tabletop Games,2487956,San Francisco,US,CA,1,108.625
2065732671,Alien Frontiers: Retro-Future Sci Fi Board Game,"Deploy your space fleet to the orbital facilities, master alien technologies, and colonize a barren planet in this new board game project.",5000,alien-frontiers-retro-future-sci-fi-board-game,US,14885.01,228,USD,1277535600,1271617421,1272337180,TRUE,34,Tabletop Games,2397426,Edmonds,US,WA,1,297.7002
662230788,Escape the Dark Sector,The game of deep space adventure for 1-4 players,16000,escape-the-dark-sector,GB,157861.76,2947,GBP,1561978800,1558536011,1559257420,TRUE,34,Tabletop Games,30720,Nottingham,GB,England,1.33559137,986.636
1325236270,Swords 'n Magic and Stuff - Cooperative Open World RPG,"Discover ancient ruins, hunt for treasure, defeat bosses and decorate your house in this immersive, hand crafted, casual online RPG.",21950,swords-n-magic-and-stuff,US,79256,2208,USD,1587042015,1520208412,1584450015,TRUE,35,Video Games,2490383,Seattle,US,WA,1,361.0751708
1923169825,The Realm,We're providing the ultimate fantasy role playing experience through unparalleled production value and interactive storytelling.,500,the-realm-0,US,1117.5,33,USD,1369579121,1330709066,1368628721,TRUE,12,Games,2367231,Boulder,US,CO,1,223.5
1567803184,The Fuzzies,"A gravity-defying game from the creators of Wavelength, The Mind, and Monikers.",10000,the-fuzzies,US,98604,2855,USD,1598026777,1588874552,1595348377,TRUE,34,Tabletop Games,12589335,Brooklyn,US,NY,1,986.04
610469921,EPHEMERID Playing cards . Precious Metal edition,"GOLD/SILVER/COPPER edition of the EPHEMERID playing cards, with precious metal coins and dices. With an ultimate box set edition.",10000,ephemerid-playing-cards-precious-metal-edition,FR,44077,631,EUR,1557525540,1554758729,1555339509,TRUE,273,Playing Cards,29332634,France,FR,Auvergne,1.19112989,440.77
1896759482,Toolcards : Fantasy GM Cards,"Toolcards are easy-to-use cards that inspire the GM to run fast, exciting adventures. Names, monsters, treasure. Toolcards has it all.",1000,toolcards-fantasy-gm-cards,US,14652,212,USD,1368125442,1364596988,1365533442,TRUE,34,Tabletop Games,2427913,Issaquah,US,WA,1,1465.2
2036256823,Super Retro Squad,A 2D retro platformer featuring gameplay and characters inspired by classic Nintendo games.,10000,super-retro-squad,US,53509.62,1853,USD,1342734168,1339202026,1340142168,TRUE,35,Video Games,2486340,Sacramento,US,CA,1,535.0962
696492277,GENKI: Covert Dock for the Nintendo Switch,"A tactical stealth dock hidden inside a portable GaN-charger. We're setting the dock free, so that any television is your playground.",50000,genki-covert-dock,US,1790946.5,26406,USD,1568433600,1554789360,1565276081,TRUE,270,Gaming Hardware,2442047,Los Angeles,US,CA,1,3581.893
1030078151,Thief's Roulette,"A Puzzling Thriller for the Nintendo Switch and PC, inspired by the Danganronpa and Zero Escape game series.",10000,thiefs-roulette,US,13887,476,USD,1539029696,1534609108,1536437696,TRUE,35,Video Games,2379574,Chicago,US,IL,1,138.87
848406445,Unexploded Cow from Cheapass Games,"Cheapass Games returns with ""Unexploded Cow,"" a fast-paced card game about mad cows searching for unexploded bombs.",10000,unexploded-cow-from-cheapass-games,US,48546.67,1314,USD,1347678000,1343605349,1344970827,TRUE,34,Tabletop Games,2490383,Seattle,US,WA,1,485.4667
412420980,Aquanox Deep Descent,"Re-imagine Aquanox with us! Pilot customized fighter ships, explore a deep sea dystopia torn by the struggle for resources & survival!",75000,aquanox-deep-descent,US,95979,2060,USD,1441974752,1409146486,1439901152,TRUE,35,Video Games,551801,Vienna,AT,Vienna,1,127.972
463371936,Aura Tactics,"An independently developed tactical RPG for mobile & web, featuring class swapping and asynchronous multiplayer!",5000,aura-tactics,US,11577.47,874,USD,1333757173,1330645494,1331168773,TRUE,272,Mobile Games,2372071,Burlington,US,VT,1,231.5494
1316306832,Kromore,Kromore is a multi era tabletop roleplaying setting that appeals to old and new RPG fans alike.,10000,kromore,US,24924,291,USD,1402963200,1397135580,1399479855,TRUE,34,Tabletop Games,2521361,Wilmington,US,NC,1,249.24
1799788210,Early Dark Tabletop Role-Playing Game,"We want to print Early Dark, our innovative, all-original role-playing game that takes place outside the typical European-Medieval fantasy setting!  ",3200,early-dark-tabletop-role-playing-game,US,6590,143,USD,1282946400,1274373789,1278905470,TRUE,34,Tabletop Games,2357536,Austin,US,TX,1,205.9375
1639044234,Grimmerspace,Starfinder Compatible Sci-Fi Horror RPG Setting & Adventures,10000,grimmerspace,US,188281.36,2842,USD,1561348740,1507135258,1558533534,TRUE,34,Tabletop Games,2459115,New York,US,NY,1,1882.8136
694655492,Lines of Fire: A fantasy battle board game. (Monthly Game Creation Project Sept 2010),"Lines of Fire: a fast-paced battle game, kicks off my monthly Game Creation Project. Thinking outside of the box, production may now be a possibility.",350,lines-of-fire-a-fantasy-battle-board-game-monthly,US,535,26,USD,1285905540,1256252218,1283342111,TRUE,34,Tabletop Games,2383144,Collingswood,US,NJ,1,152.8571429
362956707,All or One: The Sacrifice Your Friends Social Deduction Game,All or One is a hidden role card game wherein players are trapped in a room and tasked with agreeing to sacrifice one among themselves.,14000,all-or-one-a-social-deduction-escape-room,US,14069,231,USD,1506874654,1502231254,1504282654,TRUE,34,Tabletop Games,2487384,Salem,US,OR,1,100.4928571
422599588,Eminent Domain: The Next Evolution of Deck Building Games,"Find and colonize planets, harvest resources for trade and research new technology to build the best Empire!  A ""Space Civ-Lite"" Game",20000,eminent-domain-the-next-evolution-of-deck-building,US,48378,699,USD,1290571200,1286249649,1288015189,TRUE,34,Tabletop Games,2508428,Tucson,US,AZ,1,241.89
770784715,Power Rangers: Heroes of the Grid Board Game,Power Rangers: Heroes of the Grid is a co-operative board game for 2-5 players.,100000,power-rangers-heroes-of-the-grid-board-game,US,705087,3794,USD,1536282000,1533570877,1534266002,TRUE,34,Tabletop Games,2487889,San Diego,US,CA,1,705.087
1508524739,Hyperspace,An asymmetric 4X game from award winning designer Sandy Petersen,50000,hyperspace,US,609763,3222,USD,1550793600,1532539140,1548775342,TRUE,34,Tabletop Games,2483565,Rockwall,US,TX,1,1219.526
526298586,Flynn: Son of Crimson | Fast paced 2D action platformer,"Using the ancient gift of Crimson, take on the role of Flynn to halt the Scourge on the land. A beautifully crafted pixel adventure.",40000,flynn-son-of-crimson-fast-paced-2d-action-platform,US,63218.15,2455,USD,1508871619,1460662994,1506452419,TRUE,35,Video Games,2486340,Sacramento,US,CA,1,158.045375
335390912,Void Eclipse: A Sci-Fi Strategy Game,Lead an alien empire faced with a mysterious threat and discover your origins in a galaxy of unique star systems!,15000,voideclipse,US,15639,147,USD,1574872008,1568916249,1572276408,TRUE,35,Video Games,2490383,Seattle,US,WA,1,104.26
1273298398,Neon City Riders: A Cyberpunk Turf Wars Action Adventure,"Explore a decaying futuristic city in search of items, superpowers and companions to free all the turfs and unite their people again!.",150000,neon-city-riders-a-cyberpunk-turf-wars-action-adve,MX,225740,369,MXN,1502164800,1498080801,1499360002,TRUE,35,Video Games,150695,Veracruz,MX,Veracruz-Llave,0.04597066,150.4933333
985396883,Return of the Deck of the Living Dead,Sets of two 60 card zombie themed decks of playing cards. Each deck has the standard 52 plus 2 jokers and 4 grim reapers.,9500,return-of-the-deck-of-the-living-dead,US,27544,723,USD,1332286550,1328402003,1329698150,TRUE,34,Tabletop Games,2482949,Rochester,US,NY,1,289.9368421
383848862,Yoz - A World of Adventure,A handcrafted collaborative adventure board game with over 20 trillion board possibilities! Team strategy for 1 to 4 players.,1200,yoz-a-world-of-adventure,US,80490,955,USD,1547146800,1543595617,1544015432,TRUE,34,Tabletop Games,2459115,New York,US,NY,1,6707.5
433210758,Gunship: First Strike!,"A tactical space combat game that uses Cards, Boards and Dice together in an innovative new way to create epic space battles!",8500,gunship-first-strike,US,84786.03,1106,USD,1333252740,1325884805,1329274595,TRUE,34,Tabletop Games,2369383,Bristow,US,VA,1,997.4827059
1233464898,Cartegram - Find Your Adventure,"Find your next adventure using a custom pocket notebook, biodegradable stickers, instagram, and your legs. Each game is unique to you.",1500,cartegram-find-your-adventure,US,5551,205,USD,1406082600,1402626377,1403481963,TRUE,271,Live Games,2379574,Chicago,US,IL,1,370.0666667
878585480,Dragons of the Red Moon,200mm gargantuan dragons from the Red Moon unlike anything you have ever seen. Resin miniatures compatible with 5e and the 9th age.,5000,dragons-of-the-red-moon,US,191204.5,2385,USD,1555012800,1549303927,1553021690,TRUE,34,Tabletop Games,116545,Mexico City,MX,Distrito Federal,1,3824.09
1236625764,"The Book of Unusual Potions, for use with Fantasy RPGs","A systemless guide to potions for fantasy roleplaying games, written by Philip Reed. For use with many different games.",1500,the-book-of-unusual-potions-for-use-with-fantasy-rpgs,US,17198,1545,USD,1568671440,1567252600,1567330582,TRUE,34,Tabletop Games,2434077,Kyle,US,TX,1,1146.533333
1166096313,Lord Winklebottom Investigates - Murder! Mystery! Giraffes!,"A 1920s murder mystery, point and click adventure featuring a dashing giraffe detective for Nintendo Switch, Windows, MacOS and Linux!",7000,lord-winklebottom-investigates-murder-mystery-gira,GB,12551.1,473,GBP,1558104832,1553700678,1555512832,TRUE,35,Video Games,34503,Sheffield,GB,England,1.33559137,179.3014286
1941016074,Conspiracy X RPG The Paranormal Sourcebook,Explore the paranormal side of the world of Conspiracy X in this Pen & Paper RPG!,5000,conspiracy-x-rpg-the-paranormal-sourcebook,US,10354,195,USD,1327604456,1322401578,1322420456,TRUE,34,Tabletop Games,2352646,Albany,US,NY,1,207.08
2023150508,Doomtrooper - Digital Collectible Card Game,"Demonic aliens, cyber-mechanical vehicles, and interplanetary chainsaw warfare set in the world of Mutant Chronicles.",15000,doomtrooper-digital-collectible-card-game,US,31227.31,593,USD,1508943718,1454457361,1506351718,TRUE,35,Video Games,2442047,Los Angeles,US,CA,1,208.1820667
529615917,🤘 RagnaRok Star,"Earn your place in Valhalla as the greatest rock band of all time !
Fun-filled 2-4 player family board game about rock & viking culture",14000,ragnarok-star,FR,35669,981,EUR,1596211223,1579704742,1593619223,TRUE,34,Tabletop Games,29332634,France,FR,Auvergne,1.19112989,254.7785714
651563303,Cerebria - The Inside World,"Side with Bliss or Gloom, rally your Emotions and shape Cerebria's Identity in this immersive area control team game for 1-6 players.",40000,cerebria-the-inside-world,US,525045,5820,USD,1507219292,1502282396,1505232092,TRUE,34,Tabletop Games,2442047,Los Angeles,US,CA,1,1312.6125
550429733,Exile Sun - Multiplayer Conflict... Redefined,"Join the Struggle,
Unite the Colonies, 
Escape the Exile Sun.
A sci-fi conflict boardgame for 2-6 players.",18000,exile-sun-multiplayer-conflict-redefined,US,23114.5,370,USD,1325302200,1321292853,1321376056,TRUE,34,Tabletop Games,2449323,Memphis,US,TN,1,128.4138889
1623809744,UnderTale,A traditional role-playing game where no one has to get hurt.,5000,undertale,US,51124.66,2398,USD,1374678210,1370477721,1372086210,TRUE,35,Video Games,2367105,Boston,US,MA,1,1022.4932
924569520,Midgard Bestiary for 4th Edition,"The Midgard Bestiary provides 150 new, colorful, and carefully playtested creatures fully compatible with 4th Edition D&D.",3500,midgard-bestiary-for-4th-edition,US,10251,220,USD,1342411200,1337363377,1339304100,TRUE,12,Games,2433074,Kirkland,US,WA,1,292.8857143
212967092,Space Station Terrain Project - That's No Moon!,Tabletop Space Station terrain project for use with hugely popular miniatures games like X-Wing and Attack-Wing.,1500,space-station-terrain-project-thats-no-moon,US,18453,121,USD,1397703483,1394544805,1395111483,TRUE,34,Tabletop Games,2488042,San Jose,US,CA,1,1230.2
1446671987,Merchants of the Dark Road,"The road is costly, but the rewards are great! Merchants of the Dark Road is a strategy board game set in an exciting new fantasy world",35000,merchants-of-the-dark-road,US,446943,6523,USD,1593219600,1584686386,1591196560,TRUE,34,Tabletop Games,2377942,Champaign,US,IL,1,1276.98
1420440733,The Pride Deck,"A deck inspired by the LGBTQ+ & Queer Community, to help grow the visibility of all the different identities.",7200,the-pride-deck,IT,39106.5,1007,EUR,1597592868,1592761695,1595692068,TRUE,273,Playing Cards,718345,Milan,IT,Lombardy,1.19112989,543.1458333
330876844,Dreamhaven,A mini setting zine for Old-School Essentials and other OSR tabletop role-playing games.,300,dreamhaven,US,2352,181,USD,1584016817,1582233386,1582810817,TRUE,34,Tabletop Games,2352646,Albany,US,NY,1,784
147169215,Ada: Tainted Soil,Delve into colorful world of Ada and slash your way through dozens of enemies.,10000,ada-0,GB,11549.94,636,GBP,1561824485,1558943139,1559232485,TRUE,35,Video Games,493417,Gdansk,PL,Pomeranian,1.33559137,115.4994
1190376005,DROPSY: A different take on the old school adventure genre.,"Dropsy is an adventure game with a focus on exploration, emotion, and surrealism. Made complete with a hint of early 90's nostalgia.",225,dropsy-a-different-take-on-the-old-school-adventur,US,1613.47,63,USD,1320259151,1317217452,1318876751,TRUE,35,Video Games,2423704,Homeland,US,FL,1,717.0977778
656587898,Zombiotik,A local multiplayer video game where humans flee from their zombified friends.,5000,zombiotik,CA,6038.29,190,CAD,1555721628,1537813488,1553129628,TRUE,35,Video Games,29374154,Saguenay,CA,QC,0.7647932,120.7658
550376432,League of Infamy,League of Infamy is an occasionally co-operative dungeon crawler for 2-5 players where you take on the role of the despicable villains.,50000,league-of-infamy,GB,139387.5,1556,GBP,1573668000,1570197089,1572292809,TRUE,34,Tabletop Games,30720,Nottingham,GB,England,1.33559137,278.775
389318066,Counter Terrorist Agency,Prevent attacks all over the world!,10000,counter-terrorist-agency,CA,16384.29,730,CAD,1558699329,1550445096,1556107329,TRUE,35,Video Games,523920,Warsaw,PL,Masovian,0.7647932,163.8429
1171905353,SLICE 2nd edition,A role-playing game designed by kids for kids.,500,slice-2nd-edition,CA,2760.64,127,CAD,1595023200,1593727580,1593813596,TRUE,34,Tabletop Games,3369,Ottawa,CA,ON,0.7647932,552.128
1312294633,SLA Industries: Cannibal Sector 1,"Torn from the pages of the science-fiction horror RPG ""SLA Industries"", Cannibal Sector 1 comes to life in this tabletop skirmish game.",5000,sla-industries-cannibal-sector-1,GB,46743.85,511,GBP,1473375600,1468868644,1470740355,TRUE,34,Tabletop Games,12602196,South Yorkshire,GB,England,1.33559137,934.877
149646314,Muffin Time: The Random Card Game,"Collect cards, trigger traps, and murder muffins in the asdfmovie-themed card game",10000,muffin-time-the-random-card-game,GB,1051742.81,25545,GBP,1568392501,1561629141,1565800501,TRUE,34,Tabletop Games,44418,London,GB,England,1.33559137,10517.4281
1631494451,Spirittea,Relaxing in the countryside while managing a bath house for spirits~,18000,spirittea,CA,19431.79,432,CAD,1580491047,1575525216,1577899047,TRUE,35,Video Games,9807,Vancouver,CA,BC,0.7647932,107.9543889
68183243,CREATURES - the card game.,"A creative, strategic, 'survival of the fittest' card game where players battle it out with wildly unique creatures of their creation.",2500,creatures-the-card-game,US,56173.3,2218,USD,1320461765,1314652436,1317005765,TRUE,34,Tabletop Games,2441472,Long Beach,US,CA,1,2246.932
369799855,Modular Buildings and Ruins for Wargamers,"A range of detailed, modular, light weight, easy to assemble city buildings/ruins for wargamers. Available in 15mm, 20mm and 28mm.",6500,modular-buildings-and-ruins-for-wargamers,GB,8299,107,GBP,1365427900,1361820280,1362839500,TRUE,34,Tabletop Games,35801,Stafford,GB,England,1.33559137,127.6769231
753617983,Nubuwo Winter Bundle: variety in videogame music,"Discover game-inspired music and fund Tokyo's FAMI-MODE 2012 DVD, featuring live chip music performances and interviews.",8000,nubuwo-winter-bundle-transformative-videogame-musi,US,8377.92,370,USD,1356575674,1331511803,1355366074,TRUE,12,Games,28411370,Shibuya,JP,Chiba Prefecture,1,104.724
1545550520,Rubi: The Wayward Mira,"A 2D action platformer teeming with lush pixels, featuring ability-based progression paired w/ RPG elements. For PC, Switch, XBox & PS!",12000,rubi-the-wayward-mira-0,US,42956.36,1271,USD,1581009095,1565957458,1578417095,TRUE,35,Video Games,2459115,New York,US,NY,1,357.9696667
